{
  "schema_version": 2,
  "scenario_id": "SCN_MIGRATION_MATRIX",
  "scenario_revision": 1,
  "hash_algorithm": "sha256",
  "artifacts": {
    "starting_state": {
      "kind": "starting-state",
      "semantic_id": "three-technical-golden-saves-v1",
      "path": "scenarios/artifacts/SCN_MIGRATION_MATRIX/r1/starting-state.json",
      "sha256": "b412c0cb9628e89c521f4bf1c7b78d362cd48a38f100f95b66a20b81fd556234",
      "media_type": "application/json",
      "schema_version": 1
    },
    "content_set": {
      "kind": "content-set",
      "semantic_id": "technical-migration-content-v1",
      "path": "scenarios/artifacts/SCN_MIGRATION_MATRIX/r1/content-set.json",
      "sha256": "77399aab5bb5ab232161d18bf31d7469ebcab7d0485c8f9c5902d5e5c5a9e894",
      "media_type": "application/json",
      "schema_version": 1
    },
    "input_script": {
      "kind": "input-script",
      "semantic_id": "migration-matrix-v1",
      "path": "scenarios/artifacts/SCN_MIGRATION_MATRIX/r1/input-script.json",
      "sha256": "07c4fc7dccaf7460d1830bb5c629ddde8a65539dbc40905469746e164170bd89",
      "media_type": "application/json",
      "schema_version": 1
    }
  }
}
