{
  "schema_version": 2,
  "scenario_id": "SCN_SPIKE_SLICE",
  "scenario_revision": 1,
  "hash_algorithm": "sha256",
  "artifacts": {
    "starting_state": {
      "kind": "starting-state",
      "semantic_id": "technical-spike-state-v1",
      "path": "scenarios/artifacts/SCN_SPIKE_SLICE/r1/starting-state.json",
      "sha256": "23fd56f6b83c19b5a8843a7ef8491278eb14c07f3780890910a4b4079ddb107e",
      "media_type": "application/json",
      "schema_version": 1
    },
    "content_set": {
      "kind": "content-set",
      "semantic_id": "technical-building-set-v1",
      "path": "scenarios/artifacts/SCN_SPIKE_SLICE/r1/content-set.json",
      "sha256": "a0d11b4a87f5bc9300774d97b05d5e707288f1cd518a1bd145c9584734bbe94e",
      "media_type": "application/json",
      "schema_version": 1
    },
    "input_script": {
      "kind": "input-script",
      "semantic_id": "technical-spike-soak-v2",
      "path": "scenarios/artifacts/SCN_SPIKE_SLICE/r1/input-script.json",
      "sha256": "b89238141179b2f20322cb65e45d94fac3e6371bc272cd580db255d89a5c27eb",
      "media_type": "application/json",
      "schema_version": 1
    }
  }
}
